{
  "action_digest": "sha256:fc0348c18518a55fecddebd3d2765c871eb6a18f6b8fca96122aabb5869585de",
  "authority_digest": "sha256:3aa42f8de4d05b59b6b92f950646ec7bb054764c9d6135cae2bdbfb63da0d753",
  "boundary": {
    "live_provider_call": false,
    "patent_license_granted": false,
    "payment_credentials_accepted": false,
    "production_rights": false,
    "profile_version": "haltseal-public-resolve-1",
    "synthetic": true
  },
  "decision": "HOLD",
  "emission": {
    "disposition": "NO_NEW_REQUEST",
    "existing_request_record_id": "hsreq_sample_existing_unknown",
    "new_request_count": 0,
    "outcome": "UNKNOWN",
    "synthetic_request_record_id": null,
    "total_request_count_for_use": 1
  },
  "reason_codes": [
    "PROVIDER_OUTCOME_UNKNOWN"
  ],
  "receipt": {
    "jws": "eyJhbGciOiJFZERTQSIsImtpZCI6ImhhbHRzZWFsLXB1YmxpYy1zYW1wbGUtMjAyNi0wOC12MSIsInR5cCI6IkhBTFRTRUFMLUVWQUwtUkVDRUlQVCtqd3MifQ.eyJhY3Rpb24iOnsiYW1vdW50X21pbm9yIjoyNTAwMCwiY3VycmVuY3kiOiJVU0QiLCJkZXN0aW5hdGlvbl9pZCI6ImFjY291bnRfc3ludGhldGljX2EiLCJtZXJjaGFudF9pZCI6Im1lcmNoYW50X3N5bnRoZXRpY19hbHBoYSIsInRlcm1zIjoiT05FX1RJTUUifSwiYWN0aW9uX2RpZ2VzdCI6InNoYTI1NjpmYzAzNDhjMTg1MThhNTVmZWNkZGViZDNkMjc2NWM4NzFlYjZhMThmNmI4ZmNhOTYxMjJhYWJiNTg2OTU4NWRlIiwiYXVkIjoiaGFsdHNlYWwtcHVibGljLXJlY2VpcHQiLCJhdXRob3JpdHkiOnsiYXV0aG9yaXplZF9hbW91bnRfbWlub3IiOjI1MDAwLCJjdXJyZW5jeSI6IlVTRCIsImRlc3RpbmF0aW9uX2lkIjoiYWNjb3VudF9zeW50aGV0aWNfYSIsIm1lcmNoYW50X2lkIjoibWVyY2hhbnRfc3ludGhldGljX2FscGhhIiwicmVtYWluaW5nX3VzZXMiOjAsInN0YXR1cyI6IkNVUlJFTlQiLCJ0ZXJtcyI6Ik9ORV9USU1FIn0sImF1dGhvcml0eV9kaWdlc3QiOiJzaGEyNTY6M2FhNDJmOGRlNGQwNWI1OWI2YjkyZjk1MDY0NmVjN2JiMDU0NzY0YzlkNjEzNWNhZTJiZGJmYjYzZGEwZDc1MyIsImJvdW5kYXJ5Ijp7ImxpdmVfcHJvdmlkZXJfY2FsbCI6ZmFsc2UsInBhdGVudF9saWNlbnNlX2dyYW50ZWQiOmZhbHNlLCJwYXltZW50X2NyZWRlbnRpYWxzX2FjY2VwdGVkIjpmYWxzZSwicHJvZHVjdGlvbl9yaWdodHMiOmZhbHNlLCJwcm9maWxlX3ZlcnNpb24iOiJoYWx0c2VhbC1wdWJsaWMtcmVzb2x2ZS0xIiwic3ludGhldGljIjp0cnVlfSwiY2hhbGxlbmdlX2lkIjoiaHNjX3NhbXBsZV9maXhlZF8wMDAwMDAwMDAwMDEiLCJjb25zdW1wdGlvbiI6eyJzdGF0ZV9hZnRlciI6IkNPTlNVTUVEIiwic3RhdGVfYmVmb3JlIjoiQ09OU1VNRUQifSwiZGVjaXNpb24iOiJIT0xEIiwiZW1pc3Npb24iOnsiZGlzcG9zaXRpb24iOiJOT19ORVdfUkVRVUVTVCIsImV4aXN0aW5nX3JlcXVlc3RfcmVjb3JkX2lkIjoiaHNyZXFfc2FtcGxlX2V4aXN0aW5nX3Vua25vd24iLCJuZXdfcmVxdWVzdF9jb3VudCI6MCwib3V0Y29tZSI6IlVOS05PV04iLCJzeW50aGV0aWNfcmVxdWVzdF9yZWNvcmRfaWQiOm51bGwsInRvdGFsX3JlcXVlc3RfY291bnRfZm9yX3VzZSI6MX0sImlhdCI6MTc4NTYwMDAwMCwiaXNzIjoiaHR0cHM6Ly9ldmFsLm1lcmlkaWFudmVyaXR5LmNvbSIsImp0aSI6Imhzcl9zYW1wbGVfaG9sZF8wMDAwMDAwMDAwMDAxIiwicHJvZmlsZV92ZXJzaW9uIjoiaGFsdHNlYWwtcHVibGljLXJlc29sdmUtMSIsInJlYXNvbl9jb2RlcyI6WyJQUk9WSURFUl9PVVRDT01FX1VOS05PV04iXX0.LwRQi9R4uXpZFNBwAJWNS6hJ7dzxRHMobpJxcBazZ0KCIDcNp3wWciGcYdEmR1SGaj7U3riDaHJLQtj3A9svCQ",
    "receipt_id": "hsr_sample_hold_0000000000001",
    "sha256": "sha256:a68f5695fbb401ba411e08cc23bf2b22c7e638ee727b32d6d710ce96079d501b"
  }
}
