{
  "action_digest": "sha256:fc0348c18518a55fecddebd3d2765c871eb6a18f6b8fca96122aabb5869585de",
  "authority_digest": "sha256:c75ebc728de8c8fba8e11b0f820f3aecf2475a399a90ee14b36f7a8b5bd8f009",
  "boundary": {
    "live_provider_call": false,
    "patent_license_granted": false,
    "payment_credentials_accepted": false,
    "production_rights": false,
    "profile_version": "haltseal-public-resolve-1",
    "synthetic": true
  },
  "decision": "REFUSE",
  "emission": {
    "disposition": "NO_REQUEST",
    "existing_request_record_id": null,
    "new_request_count": 0,
    "outcome": "NONE",
    "synthetic_request_record_id": null,
    "total_request_count_for_use": 1
  },
  "reason_codes": [
    "AUTHORIZED_USE_ALREADY_CONSUMED"
  ],
  "receipt": {
    "jws": "eyJhbGciOiJFZERTQSIsImtpZCI6ImhhbHRzZWFsLXB1YmxpYy1zYW1wbGUtMjAyNi0wOC12MSIsInR5cCI6IkhBTFRTRUFMLUVWQUwtUkVDRUlQVCtqd3MifQ.eyJhY3Rpb24iOnsiYW1vdW50X21pbm9yIjoyNTAwMCwiY3VycmVuY3kiOiJVU0QiLCJkZXN0aW5hdGlvbl9pZCI6ImFjY291bnRfc3ludGhldGljX2EiLCJtZXJjaGFudF9pZCI6Im1lcmNoYW50X3N5bnRoZXRpY19hbHBoYSIsInRlcm1zIjoiT05FX1RJTUUifSwiYWN0aW9uX2RpZ2VzdCI6InNoYTI1NjpmYzAzNDhjMTg1MThhNTVmZWNkZGViZDNkMjc2NWM4NzFlYjZhMThmNmI4ZmNhOTYxMjJhYWJiNTg2OTU4NWRlIiwiYXVkIjoiaGFsdHNlYWwtcHVibGljLXJlY2VpcHQiLCJhdXRob3JpdHkiOnsiYXV0aG9yaXplZF9hbW91bnRfbWlub3IiOjI1MDAwLCJjdXJyZW5jeSI6IlVTRCIsImRlc3RpbmF0aW9uX2lkIjoiYWNjb3VudF9zeW50aGV0aWNfYSIsIm1lcmNoYW50X2lkIjoibWVyY2hhbnRfc3ludGhldGljX2FscGhhIiwicmVtYWluaW5nX3VzZXMiOjEsInN0YXR1cyI6IkNVUlJFTlQiLCJ0ZXJtcyI6Ik9ORV9USU1FIn0sImF1dGhvcml0eV9kaWdlc3QiOiJzaGEyNTY6Yzc1ZWJjNzI4ZGU4YzhmYmE4ZTExYjBmODIwZjNhZWNmMjQ3NWEzOTlhOTBlZTE0YjM2ZjdhOGI1YmQ4ZjAwOSIsImJvdW5kYXJ5Ijp7ImxpdmVfcHJvdmlkZXJfY2FsbCI6ZmFsc2UsInBhdGVudF9saWNlbnNlX2dyYW50ZWQiOmZhbHNlLCJwYXltZW50X2NyZWRlbnRpYWxzX2FjY2VwdGVkIjpmYWxzZSwicHJvZHVjdGlvbl9yaWdodHMiOmZhbHNlLCJwcm9maWxlX3ZlcnNpb24iOiJoYWx0c2VhbC1wdWJsaWMtcmVzb2x2ZS0xIiwic3ludGhldGljIjp0cnVlfSwiY2hhbGxlbmdlX2lkIjoiaHNjX3NhbXBsZV9maXhlZF8wMDAwMDAwMDAwMDEiLCJjb25zdW1wdGlvbiI6eyJzdGF0ZV9hZnRlciI6IkNPTlNVTUVEIiwic3RhdGVfYmVmb3JlIjoiQ09OU1VNRUQifSwiZGVjaXNpb24iOiJSRUZVU0UiLCJlbWlzc2lvbiI6eyJkaXNwb3NpdGlvbiI6Ik5PX1JFUVVFU1QiLCJleGlzdGluZ19yZXF1ZXN0X3JlY29yZF9pZCI6bnVsbCwibmV3X3JlcXVlc3RfY291bnQiOjAsIm91dGNvbWUiOiJOT05FIiwic3ludGhldGljX3JlcXVlc3RfcmVjb3JkX2lkIjpudWxsLCJ0b3RhbF9yZXF1ZXN0X2NvdW50X2Zvcl91c2UiOjF9LCJpYXQiOjE3ODU2MDAwMDAsImlzcyI6Imh0dHBzOi8vZXZhbC5tZXJpZGlhbnZlcml0eS5jb20iLCJqdGkiOiJoc3Jfc2FtcGxlX2NvbnN1bWVkXzAwMDAwMDAwMSIsInByb2ZpbGVfdmVyc2lvbiI6ImhhbHRzZWFsLXB1YmxpYy1yZXNvbHZlLTEiLCJyZWFzb25fY29kZXMiOlsiQVVUSE9SSVpFRF9VU0VfQUxSRUFEWV9DT05TVU1FRCJdfQ.0z1vvNELjd4vEasl29m7XiJ29Xc7DKaIkIG1aJPKS94gmLPc2LZ2-AlIN3cR3m29ldyJe6V4uqBjqTWxfPj2Ag",
    "receipt_id": "hsr_sample_consumed_000000001",
    "sha256": "sha256:976451144ae01a4384022eca8dab356d13d35352e89608ce93b86d03328bc53d"
  }
}
